{
 "schemat_danych": "energeks.stacja/0.3",
 "wygenerowano": "2026-10-14",
 "generator": "0.7",
 "silnik": "0.11.0",
 "producent": {
  "marka": "Energeks",
  "nazwa": "Transformatory Sp. z o.o.",
  "adres": "ul. Święty Marcin 29/8, 61-806 Poznań",
  "nip": "7831867805",
  "email": "info@energeks.com",
  "tel": "+48 664 951 947",
  "www": "www.energeks.pl",
  "sklep": "energeks.shop"
 },
 "kod": "ENG-E2x630-15S-LPTT-08-K",
 "nazwa": "Stacja transformatorowa kontenerowa 2 x 630 kVA 15/0,4 kV dla e-mobilności z pomiarem SN",
 "linia": "Stacja dla e-mobilności",
 "wejscie": {
  "linia": "E",
  "moc": 630,
  "liczbaTrafo": 2,
  "kV": 15,
  "izolacja": "s",
  "polaL": 1,
  "poleL": "L",
  "pomiar": "SN",
  "poleT": "R",
  "odplywy": 8,
  "rezerwaOdp": 0,
  "obsluga": "wewnetrzna",
  "rei120": false,
  "agregat": false,
  "ppoz": false,
  "analizator": false,
  "kompJalowy": false,
  "unn": 0.4,
  "odplywWlk": "NH2",
  "telemechanika": "brak"
 },
 "postepowanie": null,
 "opcje_dodatkowe": [],
 "parametry_wejsciowe": {
  "linia": "E",
  "auto": {
   "zaciski": true
  },
  "osd": "brak",
  "przejecieOSD": false,
  "wnetrzowa": false,
  "liczbaTrafo": 2,
  "moc": 630,
  "mocSpoza": false,
  "kV": 15,
  "ikSN": 16,
  "unn": 0.4,
  "trafoTyp": "olejowy",
  "mocDocelowa": null,
  "zaciskiMozliwe": true,
  "zaciski": "TOC-1",
  "izolacja": "s",
  "pomiarNiedostepne": {
   "nN": "dwa transformatory: pomiar po stronie SN (jeden układ pomiarowy dla obu)"
  },
  "pomiar": "SN",
  "polaL": 1,
  "poleL": "L",
  "telemechanika": "brak",
  "obsluga": "wewnetrzna",
  "rei120": false,
  "agregat": false,
  "ppoz": false,
  "analizator": false,
  "kompJalowy": false,
  "obudowaSzer": null,
  "ups": false,
  "szr": "brak",
  "odplywy": 8,
  "rezerwaOdp": 0,
  "rezerwaMin": 0,
  "rezerwaMax": 16,
  "odplywWlk": "NH2",
  "aparatNN": "R",
  "poleT": "R",
  "blokady": {
   "przejecieOSD": "stacja dla e-mobilności jest stacją odbiorcy"
  }
 },
 "dane": [
  {
   "parametr": "Napięcie sieci SN",
   "wartosc": "15 kV (urządzenia 24 kV)"
  },
  {
   "parametr": "Moc",
   "wartosc": "2 x 630 kVA, transformator olejowy"
  },
  {
   "parametr": "Prąd SN przy 15 kV",
   "wartosc": "24,2 A na transformator, 48,5 A razem"
  },
  {
   "parametr": "Prąd nN przy 400 V",
   "wartosc": "909 A na sekcję"
  },
  {
   "parametr": "Zwarcie na szynach nN",
   "wartosc": "Ik ok. 15 kA, ip ok. 36 kA; szyny Icw 20 kA/1 s"
  },
  {
   "parametr": "Rozdzielnica SN",
   "wartosc": "L + P + T z bezpiecznikami + T z bezpiecznikami, 16 kA/1 s, stało-powietrzna"
  },
  {
   "parametr": "Pomiar",
   "wartosc": "rozliczeniowy SN, przekładniki 50/5 A"
  },
  {
   "parametr": "Straty transformatora",
   "wartosc": "P0 540 W, Pk 4600 W (Tier 2), uk 6%"
  },
  {
   "parametr": "Masa transformatora",
   "wartosc": "ok. 1800 kg każdy, wymiary ok. 1450 x 900 x 1540 mm"
  },
  {
   "parametr": "Olej w transformatorze",
   "wartosc": "ok. 360 kg (ok. 409 l) w każdym"
  },
  {
   "parametr": "Osprzęt transformatora",
   "wartosc": "zaciski nN Energeks TOC-1 M30 z osłonami OZNN M30"
  },
  {
   "parametr": "Obudowa",
   "wartosc": "obudowa betonowa KSW 2,55 x 6,00 m z korytarzem obsługi, wysokość 3,72 m z piwnicą kablową (nad terenem ok. 2,82 m), masa obudowy ok. 29,4 t"
  },
  {
   "parametr": "Dostawa",
   "wartosc": "transport; rozładunek i montaż po stronie klienta"
  }
 ],
 "parametry": [
  {
   "grupa": "Dane znamionowe",
   "wiersze": [
    {
     "parametr": "Napięcie znamionowe sieci SN",
     "wartosc": "15 kV"
    },
    {
     "parametr": "Napięcie znamionowe urządzeń SN",
     "wartosc": "24 kV"
    },
    {
     "parametr": "Napięcie strony nN",
     "wartosc": "0,4 kV (transformator 0,42 kV w stanie jałowym)"
    },
    {
     "parametr": "Częstotliwość",
     "wartosc": "50 Hz"
    },
    {
     "parametr": "Moc znamionowa",
     "wartosc": "2 x 630 kVA"
    },
    {
     "parametr": "Prąd znamionowy strony SN",
     "wartosc": "24,2 A na transformator, 48,5 A razem"
    },
    {
     "parametr": "Prąd znamionowy strony nN (400 V)",
     "wartosc": "909 A na sekcję"
    },
    {
     "parametr": "Wytrzymałość zwarciowa SN",
     "wartosc": "16 kA/1 s"
    },
    {
     "parametr": "Zwarcie na szynach nN",
     "wartosc": "Ik ok. 15 kA, ip ok. 36 kA (PN-EN 60909-0, sieć SN sztywna)"
    },
    {
     "parametr": "Szyny nN",
     "wartosc": "Icw 20 kA/1 s, Ipk 40 kA, prąd szyn 1250 A"
    }
   ]
  },
  {
   "grupa": "Obudowa",
   "wiersze": [
    {
     "parametr": "Typ",
     "wartosc": "betonowa KSW 2,55 x 6,00 m, z wewnętrznym korytarzem obsługi i piwnicą kablową"
    },
    {
     "parametr": "Wymiary zewnętrzne",
     "wartosc": "2,55 x 6,00 m"
    },
    {
     "parametr": "Wysokość",
     "wartosc": "3,72 m z piwnicą kablową, nad terenem ok. 2,82 m"
    },
    {
     "parametr": "Wnętrze",
     "wartosc": "2,31 x 5,76 m, wysokość 2,45 m"
    },
    {
     "parametr": "Piwnica kablowa",
     "wartosc": "2,51 x 5,96 m, wysokość 0,88 m w świetle"
    },
    {
     "parametr": "Komora transformatora",
     "wartosc": "1,40 m w świetle (dwie); drzwi 1,17 m w ścianie frontowej, żaluzja 0,88 m w ścianie tylnej"
    },
    {
     "parametr": "Korytarz obsługi",
     "wartosc": "ok. 1,27 m; drzwi obsługi 0,95 m w ścianie frontowej"
    },
    {
     "parametr": "Dach",
     "wartosc": "betonowy, płaski, spadek ok. 2%"
    },
    {
     "parametr": "Powierzchnia zabudowy",
     "wartosc": "15,3 m2"
    },
    {
     "parametr": "Klasa obudowy (PN-EN 62271-202)",
     "wartosc": "10"
    },
    {
     "parametr": "Łuk wewnętrzny",
     "wartosc": "IAC-AB 16 kA 1 s"
    },
    {
     "parametr": "Stopień ochrony",
     "wartosc": "IP43, IK10"
    },
    {
     "parametr": "Posadowienie",
     "wartosc": "zagłębienie ok. 0,90 m na podsypce 0,10 m"
    },
    {
     "parametr": "Misa olejowa",
     "wartosc": "min. 409 l"
    },
    {
     "parametr": "Masy elementów (poglądowe)",
     "wartosc": "korpus ok. 16,3 t, fundament z piwnicą ok. 7,8 t, dach ok. 5,3 t; razem ok. 29,4 t bez aparatury"
    }
   ]
  },
  {
   "grupa": "Transformator",
   "wiersze": [
    {
     "parametr": "Typ",
     "wartosc": "2 x Transformator olejowy hermetyczny MarkoEco2 630 kVA 15,75/0,42 kV Dyn5"
    },
    {
     "parametr": "Straty i napięcie zwarcia",
     "wartosc": "P0 540 W, Pk 4600 W (Tier 2), uk 6%"
    },
    {
     "parametr": "Masa i wymiary",
     "wartosc": "ok. 1800 kg każdy, wymiary ok. 1450 x 900 x 1540 mm"
    },
    {
     "parametr": "Olej",
     "wartosc": "ok. 360 kg (ok. 409 l) w każdym"
    },
    {
     "parametr": "Zabezpieczenie",
     "wartosc": "Termometr ze stykami: sygnalizacja i wyłączenie przez wyzwalacz łącznika w polu T"
    }
   ]
  },
  {
   "grupa": "Osprzęt transformatora Energeks",
   "wiersze": [
    {
     "parametr": "Zaciski nN",
     "wartosc": "Energeks TOC-1 M30: 3 x TOC-1/U (DP 5300) i 1 x TOC-1/N (DP 5300N) (na każdy transformator); poziome, bezkońcówkowe, 1000 A; gniazda 2 x 95-240 mm2 (Al lub Cu) i 2 x 2,5-50 mm2 na ograniczniki, pomiar i potrzeby własne; korpus z odkuwki mosiężnej ocynowanej, śruby mocujące ze stali nierdzewnej, dociskowe z mosiądzu; zacisk /N z przyłączem uziemienia roboczego; PN-EN 60947-7-1; do transformatorów MarkoEco2; karty katalogowe 5-65/15 i 6-65/15; energeks.shop/zacisk-transformatorowy-toc-1.html"
    },
    {
     "parametr": "Osłony zacisków nN",
     "wartosc": "Energeks OZNN M30 (na każdy transformator); osłony zacisków nN z elastycznego tworzywa samogasnącego, zakładane po podłączeniu kabli; energeks.shop/oslona-izolacyjna-oznn.html"
    }
   ]
  },
  {
   "grupa": "Rozdzielnica SN",
   "wiersze": [
    {
     "parametr": "Układ pól",
     "wartosc": "L + P + T z bezpiecznikami + T z bezpiecznikami, 16 kA/1 s, stało-powietrzna"
    },
    {
     "parametr": "Pole transformatorowe",
     "wartosc": "rozłącznik z bezpiecznikami HH 40 A"
    },
    {
     "parametr": "Pole pomiarowe",
     "wartosc": "przekładniki prądowe 50/5 A kl. 0,2S; Ith 16 kA/1 s; przekładniki napięciowe 15/√3 / 0,1/√3 / 0,1/3 kV kl. 0,2 lub 0,5 (wg kategorii układu w IRiESD), z bezpiecznikami SN"
    },
    {
     "parametr": "Połączenie z transformatorem",
     "wartosc": "3 x XRUHAKXS 1x70/16 mm2 12/20 kV z głowicami lub konektorami"
    }
   ]
  },
  {
   "grupa": "Rozdzielnica nN",
   "wiersze": [
    {
     "parametr": "Aparat główny",
     "wartosc": "2 x rozłącznik izolacyjny 1250 A; na transformator 630 kVA, prąd 909 A przy 400 V; zapas na przeciążenie transformatora"
    },
    {
     "parametr": "Szyny",
     "wartosc": "Szyny 1250 A, Icw 20 kA/1 s, Ipk 40 kA; prąd zwarciowy początkowy ok. 15 kA, udarowy ok. 36 kA (sieć SN sztywna, PN-EN 60909-0)"
    },
    {
     "parametr": "Odpływy",
     "wartosc": "8 odpływów z rozłącznikami bezpiecznikowymi NH2 400 A na sekcję; wkładki dobiera projektant z zachowaniem selektywności z bezpiecznikami SN; odpływy do ładowarek, rezerwa miejsca na kolejne"
    },
    {
     "parametr": "Ochrona przepięciowa",
     "wartosc": "Ograniczniki przepięć nN typu 1+2"
    },
    {
     "parametr": "Sekcje szyn",
     "wartosc": "Dwie sekcje szyn ze sprzęgłem; sprzęgło normalnie otwarte, blokada przed pracą równoległą"
    },
    {
     "parametr": "Połączenie z transformatorem",
     "wartosc": "2 x 4 x YKXS 1x240 mm2, 2 kable na fazę i N"
    }
   ]
  },
  {
   "grupa": "Pomiar",
   "wiersze": [
    {
     "parametr": "Pomiar rozliczeniowy po stronie SN (pośredni)",
     "wartosc": "przekładniki prądowe 50/5 A kl. 0,2S i napięciowe w polu P; szafka licznikowa z listwą probierczą, miejscem na licznik i modem OSD oraz zasilaniem rezerwowym (UPS); przekładnia ostatecznie wg warunków przyłączenia"
    }
   ]
  },
  {
   "grupa": "Warunki pracy",
   "wiersze": [
    {
     "parametr": "Warunki normalne",
     "wartosc": "wg PN-EN 62271-1: temperatura otoczenia od -25 do +40 st. C, wysokość do 1000 m n.p.m., wiatr do 34 m/s; potwierdzane certyfikatem stacji"
    },
    {
     "parametr": "Miejsce pracy",